{
  "schema_version": "0.1.0",
  "dataset_id": "small_school_demo",
  "school": {
    "id": "demo_school",
    "label": "Synthetic Demonstration School",
    "timezone": "Europe/Minsk"
  },
  "academic_period": {
    "id": "term_1_2026",
    "label": "Synthetic Term 1",
    "start_date": "2026-09-01",
    "end_date": "2026-12-24",
    "days": [
      {
        "id": "mon",
        "label": "Monday",
        "ordinal": 1
      },
      {
        "id": "tue",
        "label": "Tuesday",
        "ordinal": 2
      },
      {
        "id": "wed",
        "label": "Wednesday",
        "ordinal": 3
      },
      {
        "id": "thu",
        "label": "Thursday",
        "ordinal": 4
      },
      {
        "id": "fri",
        "label": "Friday",
        "ordinal": 5
      }
    ],
    "periods": [
      {
        "id": "p1",
        "label": "Period 1",
        "ordinal": 1,
        "start_time": "08:00",
        "end_time": "08:45"
      },
      {
        "id": "p2",
        "label": "Period 2",
        "ordinal": 2,
        "start_time": "08:55",
        "end_time": "09:40"
      },
      {
        "id": "p3",
        "label": "Period 3",
        "ordinal": 3,
        "start_time": "10:00",
        "end_time": "10:45"
      },
      {
        "id": "p4",
        "label": "Period 4",
        "ordinal": 4,
        "start_time": "11:05",
        "end_time": "11:50"
      },
      {
        "id": "p5",
        "label": "Period 5",
        "ordinal": 5,
        "start_time": "12:00",
        "end_time": "12:45"
      },
      {
        "id": "p6",
        "label": "Period 6",
        "ordinal": 6,
        "start_time": "12:55",
        "end_time": "13:40"
      },
      {
        "id": "p7",
        "label": "Period 7",
        "ordinal": 7,
        "start_time": "13:50",
        "end_time": "14:35"
      }
    ],
    "shifts": [
      {
        "id": "morning",
        "label": "Morning shift",
        "period_ids": ["p1", "p2", "p3", "p4", "p5", "p6", "p7"]
      }
    ]
  },
  "subjects": [
    {
      "id": "mathematics",
      "label": "Mathematics",
      "default_workload": 3
    },
    {
      "id": "physics",
      "label": "Physics",
      "default_workload": 3
    },
    {
      "id": "chemistry",
      "label": "Chemistry",
      "default_workload": 3
    },
    {
      "id": "english",
      "label": "English",
      "default_workload": 2
    },
    {
      "id": "history",
      "label": "History",
      "default_workload": 2
    },
    {
      "id": "physical_education",
      "label": "Physical Education",
      "default_workload": 1
    },
    {
      "id": "advisory",
      "label": "Advisory",
      "default_workload": 1
    }
  ],
  "teachers": [
    {
      "id": "t_math",
      "label": "Teacher T-Math",
      "qualified_subject_ids": ["mathematics"]
    },
    {
      "id": "t_science",
      "label": "Teacher T-Science",
      "qualified_subject_ids": ["physics", "chemistry"]
    },
    {
      "id": "t_english_a",
      "label": "Teacher T-English-A",
      "qualified_subject_ids": ["english"]
    },
    {
      "id": "t_english_b",
      "label": "Teacher T-English-B",
      "qualified_subject_ids": ["english"]
    },
    {
      "id": "t_history",
      "label": "Teacher T-History",
      "qualified_subject_ids": ["history", "advisory"]
    },
    {
      "id": "t_pe",
      "label": "Teacher T-PE",
      "qualified_subject_ids": ["physical_education"]
    }
  ],
  "classrooms": [
    {
      "id": "room_101",
      "label": "Room 101",
      "capacity": 30,
      "capabilities": ["general"]
    },
    {
      "id": "room_102",
      "label": "Room 102",
      "capacity": 30,
      "capabilities": ["general"]
    },
    {
      "id": "science_lab",
      "label": "Science Laboratory",
      "capacity": 24,
      "capabilities": ["general", "physics_lab", "chemistry_lab"]
    },
    {
      "id": "gym",
      "label": "Gymnasium",
      "capacity": 60,
      "capabilities": ["sports"]
    },
    {
      "id": "hall",
      "label": "Assembly Hall",
      "capacity": 60,
      "capabilities": ["assembly"]
    }
  ],
  "classes": [
    {
      "id": "class_7a",
      "label": "Class 7A",
      "grade": 7,
      "student_count": 24,
      "shift_id": "morning"
    },
    {
      "id": "class_8a",
      "label": "Class 8A",
      "grade": 8,
      "student_count": 22,
      "shift_id": "morning"
    }
  ],
  "group_partitions": [
    {
      "id": "partition_7a_english",
      "label": "Class 7A English groups",
      "class_id": "class_7a",
      "complete": true
    }
  ],
  "groups": [
    {
      "id": "group_7a_en_1",
      "label": "Class 7A English Group 1",
      "class_id": "class_7a",
      "partition_id": "partition_7a_english",
      "student_count": 12
    },
    {
      "id": "group_7a_en_2",
      "label": "Class 7A English Group 2",
      "class_id": "class_7a",
      "partition_id": "partition_7a_english",
      "student_count": 12
    }
  ],
  "cohorts": [
    {
      "id": "cohort_7a_8a_advisory",
      "label": "Classes 7A and 8A Advisory",
      "members": [
        {
          "type": "class",
          "id": "class_7a"
        },
        {
          "type": "class",
          "id": "class_8a"
        }
      ]
    }
  ],
  "curriculum_requirements": [
    {
      "id": "req_7a_math",
      "participant": {
        "type": "class",
        "id": "class_7a"
      },
      "subject_id": "mathematics",
      "eligible_teacher_ids": ["t_math"],
      "weekly_lessons": 4,
      "block_length": 1,
      "required_room_capabilities": ["general"],
      "allowed_classroom_ids": []
    },
    {
      "id": "req_7a_physics",
      "participant": {
        "type": "class",
        "id": "class_7a"
      },
      "subject_id": "physics",
      "eligible_teacher_ids": ["t_science"],
      "weekly_lessons": 2,
      "block_length": 1,
      "required_room_capabilities": ["physics_lab"],
      "allowed_classroom_ids": ["science_lab"]
    },
    {
      "id": "req_7a_en_1",
      "participant": {
        "type": "group",
        "id": "group_7a_en_1"
      },
      "subject_id": "english",
      "eligible_teacher_ids": ["t_english_a"],
      "weekly_lessons": 2,
      "block_length": 1,
      "required_room_capabilities": ["general"],
      "allowed_classroom_ids": []
    },
    {
      "id": "req_7a_en_2",
      "participant": {
        "type": "group",
        "id": "group_7a_en_2"
      },
      "subject_id": "english",
      "eligible_teacher_ids": ["t_english_b"],
      "weekly_lessons": 2,
      "block_length": 1,
      "required_room_capabilities": ["general"],
      "allowed_classroom_ids": []
    },
    {
      "id": "req_7a_history",
      "participant": {
        "type": "class",
        "id": "class_7a"
      },
      "subject_id": "history",
      "eligible_teacher_ids": ["t_history"],
      "weekly_lessons": 2,
      "block_length": 1,
      "required_room_capabilities": ["general"],
      "allowed_classroom_ids": []
    },
    {
      "id": "req_7a_pe",
      "participant": {
        "type": "class",
        "id": "class_7a"
      },
      "subject_id": "physical_education",
      "eligible_teacher_ids": ["t_pe"],
      "weekly_lessons": 2,
      "block_length": 1,
      "required_room_capabilities": ["sports"],
      "allowed_classroom_ids": ["gym"]
    },
    {
      "id": "req_8a_math",
      "participant": {
        "type": "class",
        "id": "class_8a"
      },
      "subject_id": "mathematics",
      "eligible_teacher_ids": ["t_math"],
      "weekly_lessons": 4,
      "block_length": 1,
      "required_room_capabilities": ["general"],
      "allowed_classroom_ids": []
    },
    {
      "id": "req_8a_chemistry",
      "participant": {
        "type": "class",
        "id": "class_8a"
      },
      "subject_id": "chemistry",
      "eligible_teacher_ids": ["t_science"],
      "weekly_lessons": 2,
      "block_length": 2,
      "required_room_capabilities": ["chemistry_lab"],
      "allowed_classroom_ids": ["science_lab"]
    },
    {
      "id": "req_8a_english",
      "participant": {
        "type": "class",
        "id": "class_8a"
      },
      "subject_id": "english",
      "eligible_teacher_ids": ["t_english_a", "t_english_b"],
      "weekly_lessons": 3,
      "block_length": 1,
      "required_room_capabilities": ["general"],
      "allowed_classroom_ids": []
    },
    {
      "id": "req_8a_history",
      "participant": {
        "type": "class",
        "id": "class_8a"
      },
      "subject_id": "history",
      "eligible_teacher_ids": ["t_history"],
      "weekly_lessons": 2,
      "block_length": 1,
      "required_room_capabilities": ["general"],
      "allowed_classroom_ids": []
    },
    {
      "id": "req_8a_pe",
      "participant": {
        "type": "class",
        "id": "class_8a"
      },
      "subject_id": "physical_education",
      "eligible_teacher_ids": ["t_pe"],
      "weekly_lessons": 2,
      "block_length": 1,
      "required_room_capabilities": ["sports"],
      "allowed_classroom_ids": ["gym"]
    },
    {
      "id": "req_joint_advisory",
      "participant": {
        "type": "cohort",
        "id": "cohort_7a_8a_advisory"
      },
      "subject_id": "advisory",
      "eligible_teacher_ids": ["t_history"],
      "weekly_lessons": 1,
      "block_length": 1,
      "required_room_capabilities": ["assembly"],
      "allowed_classroom_ids": ["hall"]
    }
  ],
  "resource_availability": [
    {
      "resource": {
        "type": "teacher",
        "id": "t_math"
      },
      "unavailable_slots": [
        {
          "day_id": "tue",
          "period_id": "p1"
        }
      ],
      "preferred_slots": [
        {
          "day_id": "mon",
          "period_id": "p2"
        }
      ]
    },
    {
      "resource": {
        "type": "classroom",
        "id": "science_lab"
      },
      "unavailable_slots": [
        {
          "day_id": "fri",
          "period_id": "p6"
        }
      ],
      "preferred_slots": []